{
  "$comment": "Hand-reviewed exact inventory of pinned install/*.packages. Availability describes the default module or a validated attribute, not full OS/package closure parity.",
  "pin": "v4.0.3",
  "upstream_rev": "0534987009061cbe2dacdde4ad564092ab698d12",
  "generated": false,
  "packages": [
    {
      "upstream": "aether",
      "status": "pkgs",
      "attr": "aether",
      "availability": "default",
      "notes": "Flake package supplied by the default Omarchy module.",
      "sources": [
        "install/omarchy-base.packages"
      ]
    },
    {
      "upstream": "alsa-utils",
      "status": "nixpkgs",
      "attr": "alsa-utils",
      "availability": "default",
      "notes": "Included in the default module package/font set.",
      "sources": [
        "install/omarchy-base.packages"
      ]
    },
    {
      "upstream": "apple-bcm-firmware",
      "status": "gap",
      "notes": "Optional upstream hardware support has no audited Omahedron mapping yet. Not installed or advertised as supported; host integration needs separate validation.",
      "sources": [
        "install/omarchy-other.packages"
      ]
    },
    {
      "upstream": "apple-t2-audio-config",
      "status": "gap",
      "notes": "Optional upstream hardware support has no audited Omahedron mapping yet. Not installed or advertised as supported; host integration needs separate validation.",
      "sources": [
        "install/omarchy-other.packages"
      ]
    },
    {
      "upstream": "asdcontrol",
      "status": "pkgs",
      "attr": "asdcontrol",
      "availability": "default",
      "notes": "Flake package supplied by the default Omarchy module.",
      "sources": [
        "install/omarchy-base.packages"
      ]
    },
    {
      "upstream": "asusctl",
      "status": "host",
      "options": [
        "services.asusd.enable"
      ],
      "notes": "ASUS-specific support is a host opt-in; not enabled by the desktop module.",
      "sources": [
        "install/omarchy-other.packages"
      ]
    },
    {
      "upstream": "autoconf-archive",
      "status": "nixpkgs",
      "attr": "autoconf-archive",
      "availability": "available",
      "notes": "Nixpkgs counterpart available to consumers; not asserted as a separate default module package. Hardware/plugin activation, where needed, is host-owned.",
      "sources": [
        "install/omarchy-other.packages"
      ]
    },
    {
      "upstream": "avahi",
      "status": "host",
      "options": [
        "services.avahi.enable"
      ],
      "notes": "Avahi service is enabled by default; consumers may override.",
      "sources": [
        "install/omarchy-base.packages"
      ]
    },
    {
      "upstream": "base",
      "status": "exclude",
      "notes": "Arch metapackage or kernel module lifecycle tooling; NixOS owns the base system, build environments and kernel modules.",
      "sources": [
        "install/omarchy-other.packages"
      ]
    },
    {
      "upstream": "base-devel",
      "status": "exclude",
      "notes": "Arch metapackage or kernel module lifecycle tooling; NixOS owns the base system, build environments and kernel modules.",
      "sources": [
        "install/omarchy-other.packages"
      ]
    },
    {
      "upstream": "bash-completion",
      "status": "nixpkgs",
      "attr": "bash-completion",
      "availability": "default",
      "notes": "Included in the default module package/font set.",
      "sources": [
        "install/omarchy-base.packages"
      ]
    },
    {
      "upstream": "bat",
      "status": "nixpkgs",
      "attr": "bat",
      "availability": "default",
      "notes": "Included in the default module package/font set.",
      "sources": [
        "install/omarchy-base.packages"
      ]
    },
    {
      "upstream": "bluez",
      "status": "nixpkgs",
      "attr": "bluez",
      "availability": "default",
      "notes": "Included in the default module package/font set.",
      "sources": [
        "install/omarchy-base.packages"
      ]
    },
    {
      "upstream": "bluez-tools",
      "status": "nixpkgs",
      "attr": "bluez-tools",
      "availability": "default",
      "notes": "Included in the default module package/font set.",
      "sources": [
        "install/omarchy-base.packages"
      ]
    },
    {
      "upstream": "bluez-utils",
      "status": "nixpkgs",
      "attr": "bluez",
      "availability": "default",
      "notes": "Arch name mapped to the Nixpkgs attribute in the default module package/font set.",
      "sources": [
        "install/omarchy-base.packages"
      ]
    },
    {
      "upstream": "bolt",
      "status": "host",
      "options": [
        "services.hardware.bolt.enable"
      ],
      "notes": "Thunderbolt authorization service is enabled by default.",
      "sources": [
        "install/omarchy-base.packages"
      ]
    },
    {
      "upstream": "brightnessctl",
      "status": "nixpkgs",
      "attr": "brightnessctl",
      "availability": "default",
      "notes": "Included in the default module package/font set.",
      "sources": [
        "install/omarchy-base.packages"
      ]
    },
    {
      "upstream": "broadcom-wl-dkms",
      "status": "exclude",
      "notes": "Arch out-of-tree driver packaging is not shipped; the host must select a compatible NixOS kernel/driver configuration.",
      "sources": [
        "install/omarchy-other.packages"
      ]
    },
    {
      "upstream": "btop",
      "status": "nixpkgs",
      "attr": "btop",
      "availability": "default",
      "notes": "Included in the default module package/font set.",
      "sources": [
        "install/omarchy-base.packages"
      ]
    },
    {
      "upstream": "btrfs-progs",
      "status": "host",
      "options": [
        "boot.supportedFilesystems"
      ],
      "notes": "Filesystem tools follow the host filesystem configuration; no assumption that the host uses Btrfs.",
      "sources": [
        "install/omarchy-other.packages"
      ]
    },
    {
      "upstream": "chromium",
      "status": "nixpkgs",
      "attr": "chromium",
      "availability": "default",
      "notes": "Included in the default module package/font set.",
      "sources": [
        "install/omarchy-base.packages"
      ]
    },
    {
      "upstream": "clang",
      "status": "nixpkgs",
      "attr": "clang",
      "availability": "default",
      "notes": "Included in the default module package/font set.",
      "sources": [
        "install/omarchy-base.packages"
      ]
    },
    {
      "upstream": "cliamp",
      "status": "nixpkgs",
      "attr": "cliamp",
      "availability": "default",
      "notes": "Included in the default module package/font set.",
      "sources": [
        "install/omarchy-base.packages"
      ]
    },
    {
      "upstream": "cups",
      "status": "host",
      "options": [
        "services.printing.enable"
      ],
      "notes": "CUPS and its NixOS-selected filter/helper dependencies are owned by the printing module, enabled by default.",
      "sources": [
        "install/omarchy-base.packages"
      ]
    },
    {
      "upstream": "cups-filters",
      "status": "host",
      "options": [
        "services.printing.enable"
      ],
      "notes": "CUPS and its NixOS-selected filter/helper dependencies are owned by the printing module, enabled by default.",
      "sources": [
        "install/omarchy-base.packages"
      ]
    },
    {
      "upstream": "cups-pk-helper",
      "status": "host",
      "options": [
        "services.printing.enable"
      ],
      "notes": "CUPS and its NixOS-selected filter/helper dependencies are owned by the printing module, enabled by default.",
      "sources": [
        "install/omarchy-base.packages"
      ]
    },
    {
      "upstream": "ddcutil",
      "status": "nixpkgs",
      "attr": "ddcutil",
      "availability": "default",
      "notes": "Included in the default module package/font set.",
      "sources": [
        "install/omarchy-base.packages"
      ]
    },
    {
      "upstream": "dell-xps-touchpad-haptics",
      "status": "gap",
      "notes": "Optional upstream hardware support has no audited Omahedron mapping yet. Not installed or advertised as supported; host integration needs separate validation.",
      "sources": [
        "install/omarchy-other.packages"
      ]
    },
    {
      "upstream": "dkms",
      "status": "exclude",
      "notes": "Arch metapackage or kernel module lifecycle tooling; NixOS owns the base system, build environments and kernel modules.",
      "sources": [
        "install/omarchy-other.packages"
      ]
    },
    {
      "upstream": "docker",
      "status": "host",
      "options": [
        "virtualisation.docker.enable"
      ],
      "notes": "Workstation profile only (omarchy.profile = \"workstation\"); NixOS supplies the engine and CLI plugins.",
      "sources": [
        "install/omarchy-base.packages"
      ]
    },
    {
      "upstream": "docker-buildx",
      "status": "host",
      "options": [
        "virtualisation.docker.enable"
      ],
      "notes": "Workstation profile only (omarchy.profile = \"workstation\"); NixOS supplies the engine and CLI plugins.",
      "sources": [
        "install/omarchy-base.packages"
      ]
    },
    {
      "upstream": "docker-compose",
      "status": "host",
      "options": [
        "virtualisation.docker.enable"
      ],
      "notes": "Workstation profile only (omarchy.profile = \"workstation\"); NixOS supplies the engine and CLI plugins.",
      "sources": [
        "install/omarchy-base.packages"
      ]
    },
    {
      "upstream": "dosfstools",
      "status": "nixpkgs",
      "attr": "dosfstools",
      "availability": "default",
      "notes": "Included in the default module package/font set.",
      "sources": [
        "install/omarchy-base.packages"
      ]
    },
    {
      "upstream": "dotnet-runtime",
      "status": "nixpkgs",
      "attr": "dotnet-runtime",
      "availability": "default",